"Movie Title","Year","Runtime","Genre 1","Genre 2","Genre 3","Description","Director","Actor 1","Actor 2","Actor 3","Actor 4"
"Cavalgada","1933","112","Drama","Romance","War","A portrayal of the triumphs and tragedies of two English families, the upper-crust Marryots and the working-class Bridgeses, from 1899 to 1933.","Frank Lloyd"," Diana Wynyard"," Clive Brook"," Una O'Connor"," Herbert Mundin"
"Grande Hotel","1932","112","Drama","Romance","","A group of very different individuals staying at a luxurious hotel in Berlin deal with each of their respective dramas.","Edmund Goulding"," Greta Garbo"," John Barrymore"," Joan Crawford"," Wallace Beery"
"Cimarron","1931","123","Drama","Western","","A newspaper editor settles in an Oklahoma boom town with his reluctant wife at the end of the nineteenth century.","Wesley Ruggles"," Richard Dix"," Irene Dunne"," Estelle Taylor"," Nance O'Neil"
"Sem Novidade no Front","1930","152","Drama","War","","A German youth eagerly enters World War I, but his enthusiasm wanes as he gets a firsthand view of the horror.","Lewis Milestone"," Lew Ayres"," Louis Wolheim"," John Wray"," Arnold Lucy"
"Melodia da Broadway","1929","100","Drama","Musical","Romance","A pair of sisters from the vaudeville circuit try to make it big time on Broadway, but matters of the heart complicate the attempt.","Harry Beaumont"," Bessie Love"," Anita Page"," Charles King"," Eddie Kane"
"Asas","1927","144","Drama","Romance","War","Two young men, one rich, one middle class, who are in love with the same woman, become fighter pilots in World War I.","William A. Wellman"," Clara Bow"," Charles 'Buddy' Rogers"," Richard Arlen"," Jobyna Ralston"
"Aurora","1927","94","Drama","Romance","","A sophisticated urban woman seduces a farmer in the hopes that he will murder his neglected wife and join her in the city, but he soon finds himself rekindling his romance with the latter when she discovers their scheme.","F.W. Murnau"," George O'Brien"," Janet Gaynor"," Margaret Livingston"," Bodil Rosing"
